date,title,detail,source_id
2025-04-10,Risk was visible before the war,"ChemAnalyst said Israeli bromine prices were stable, but geopolitical risk and logistics uncertainty were already rising before the strikes.",chemanalyst-israel-bromine-apr-2025
2025-06-13,Israel launches strikes on Iran,The June 13 strike starts the conflict window used in this page.,cfr-iran-israel-july-2025
2025-06-19,Shipping risk premium spikes,"Shell warned the conflict could have a huge trade impact, and tanker day-rates on the route jumped sharply.",guardian-shell-hormuz-june-2025
2025-06-24,Ceasefire closes the main war window,This is the end date used for the event-window share-price and market comparison.,cfr-iran-israel-july-2025
2026-02-11,Archean says customers did not materially repivot,Management said it had not heard any significant shift from customers toward India and saw no immediate upside from the conflict.,archean-q3fy26-transcript
